{
  "case_id": "case_p02_demo",
  "package_code": "P02",
  "patient": {
    "name": "耿婷婷",
    "gender": "女",
    "age": "34岁",
    "phone": "",
    "symptoms": ""
  },
  "report": {
    "assessment_type": "肠道功能评估健康管理报告",
    "method": "微生态综合评估",
    "assessment_date": "2026年5月"
  },
  "sample": {
    "type": "肠道菌群"
  },
  "lab_results": [
    {
      "item_code": "fecal_calprotectin",
      "display_name": "粪便钙卫蛋白",
      "value_raw": "弱阳性",
      "reference_range": "阴性",
      "result_level": "weak_positive"
    }
  ],
  "p02": {
    "calprotectin": {
      "result_display": "弱阳性（↑）",
      "reference_range": "阴性",
      "interpretation": "钙卫蛋白是肠道炎症的生物标志物。当前结果提示肠道炎症相关指标需要关注。"
    },
    "total_ige": {
      "result_display": "阳性（↑）",
      "reference_range": "阴性",
      "interpretation": "总 IgE 阳性提示过敏相关免疫反应需要关注。"
    },
    "allergen": {
      "overall_result": "所有检测项目均为阴性",
      "reference_range": "阴性",
      "interpretation": "当前未见已检测过敏原的阳性反应，建议结合实际症状继续观察。"
    },
    "overall_summary": "根据当前检测结果，肠道炎症相关指标和过敏相关免疫指标需要健康管理师进一步审查。",
    "followup_advice": "建议结合症状、既往史和其他检查结果进行综合评估，并按平台审查流程确认报告内容。",
    "immune_system_summary": "肠道免疫状态与炎症指标可能相互影响，需要结合个体症状和检测结果综合审查。",
    "inflammation_immune_advice": "建议采用温和、可持续的饮食与生活方式管理，并由健康管理师确认最终干预建议。"
  },
  "ai_outputs": {},
  "version_lock": {
    "template_version": "P02-html-v0.1",
    "rule_version": "P02-rules-v0.1-draft",
    "prompt_version": "P02-prompts-v0.1",
    "ai_model": "deepseek-v4"
  }
}
